"Insight Number","Insight","Seats Won","Party Details","State","Data Source"
"1","BJP Dominance: The Bharatiya Janata Party (BJP) emerged as the clear winner, securing 240 seats out of 543, reinforcing its stronghold in Indian politics","240","BJP","National","https://results.eci.gov.in"
"2","INC Performance: The Indian National Congress (INC) secured 99 seats, maintaining its position as the primary opposition party but significantly trailing behind the BJP","99","INC","National","https://results.eci.gov.in"
"3","Regional Parties' Impact: Regional parties like the Samajwadi Party (SP) with 37 seats, All India Trinamool Congress (AITC) with 29 seats, and Dravida Munnetra Kazhagam (DMK) with 22 seats demonstrated strong performances in their respective states","37, 29, 22","SP, AITC, DMK","Uttar Pradesh, West Bengal, Tamil Nadu","https://results.eci.gov.in"
"4","Emergence of New Players: Parties like the Bharat Adivasi Party and Voice of the People Party managed to win single seats, highlighting the growing influence of smaller and newer political entities in the Indian electoral landscape","1, 1","BAP, VPP","Various","https://results.eci.gov.in"
"5","Coalition Dynamics: The BJP's allies, including the Shiv Sena (Uddhav Balasaheb Thackeray) with 9 seats and the Lok Janshakti Party (Ram Vilas) with 5 seats, contributed to the overall strength of the NDA coalition","9, 5","Shiv Sena (UBT), LJP (RV)","Maharashtra, Bihar","https://results.eci.gov.in"
"6","Decline of Left Parties: The Communist Party of India (Marxist) and other left-leaning parties saw limited success, securing only a handful of seats (4 for CPI(M), 2 for CPI) across the country","4, 2","CPI(M), CPI","Various","https://results.eci.gov.in"
"7","Aam Aadmi Party's Presence: The Aam Aadmi Party (AAP) secured 3 seats, indicating its growing footprint beyond Delhi and Punjab","3","AAP","Various","https://results.eci.gov.in"
"8","Independent Candidates: Seven independent candidates won seats, demonstrating voter willingness to support non-affiliated representatives in certain constituencies","7","Independents","Various","https://results.eci.gov.in"
"9","State-Wise Insights: In states like Andhra Pradesh, the Telugu Desam Party (TDP) secured a significant number of seats (16), while in Tamil Nadu, the DMK and its allies dominated the results","16","TDP","Andhra Pradesh","https://results.eci.gov.in"
"10","Voter Turnout and Engagement: The high voter turnout and active engagement in the election process underscored the robust nature of India's democracy, with diverse representation across various political and social spectrums","N/A","N/A","National","https://results.eci.gov.in"
